{
  "$schema": "https://roblox-top1.local/schemas/art-constitution.schema.json",
  "schemaVersion": "1.1.0",
  "constitutionId": "salvaged-frontier-industrial-readability-v1",
  "version": "1.0.1",
  "status": "CREATIVE_DIRECTION_LOCKED",
  "productionApproved": false,
  "selectedTerritory": "salvaged-frontier",
  "identityAuthority": "salvaged-frontier",
  "readabilityDiscipline": "industrial-toy-defense",
  "lockedBy": "Founder",
  "lockedAt": "2026-07-16T15:36:48Z",
  "authorityMigration": {
    "recordedAt": "2026-07-17T21:52:35Z",
    "recordedBy": "Codex under the founder-authorized complete repository correction",
    "reason": "Replace the brittle whole-GDD hash with a versioned product-to-art projection that invalidates canons only when selected art-relevant GDD sections change.",
    "semanticArtDirectionChange": false,
    "previousBinding": "whole GDD SHA-256",
    "currentBinding": "art/authority/product-art-authority-v1.json"
  },
  "thesis": "A warm, intelligent frontier civilization survives by standardizing what must remain dependable and visibly adapting what history has damaged. Every object is a clear tool first, a record of player ingenuity second, and decorative scenery never.",
  "playerPromise": "The player can recognize function, ownership, orientation, danger and state in one second on mobile, then discover a deeper construction history that makes the fortress feel personally authored, repairable, persistent and worth improving with friends.",
  "precedenceContract": {
    "identityWins": "Salvaged Frontier decides what the world means, remembers and feels.",
    "disciplineRole": "Industrial Toy Defense constrains clarity, thickness, hierarchy, modularity and state readability.",
    "conflictRule": "When narrative texture and immediate comprehension conflict, preserve the Salvaged Frontier meaning through a simpler, thicker and more causal expression instead of importing Industrial Toy Defense motifs.",
    "hybridizationForbidden": true
  },
  "inheritanceContract": {
    "fromSalvagedFrontier": [
      "Purposeful repair history, recovered technology and warm evidence of human intervention.",
      "Controlled asymmetry that explains replacement, reinforcement, sealing or rerouting.",
      "A fortress culture whose objects accumulate memory without losing standardized gameplay anchors.",
      "Material aging caused by impact, heat, contact, ground abrasion or an explicit repair operation.",
      "A hopeful survival tone in which scarcity produces ingenuity rather than misery or visual decay."
    ],
    "fromIndustrialToyDefense": [
      "Primary function must be readable from silhouette before surface detail.",
      "Structural volumes remain thick, graspable, modular and visually load-bearing.",
      "Large bevels, protected apertures and explicit joints make construction understandable.",
      "Semantic accents remain bounded, local and redundant with shape, motion and audio.",
      "Repeated assets preserve a calm mass hierarchy and never collapse into visual chatter."
    ],
    "explicitlyRejected": [
      "A fifty-fifty visual hybrid or any requirement to make the world literally resemble a construction toy.",
      "Random scrap silhouettes, universal rust, cable spaghetti, micro-greebles and uniform distress.",
      "Pristine molded-plastic surfaces, near-perfect symmetry and cheerful toy color blocking as world identity.",
      "Military realism, photoreal apocalypse, bleak monochrome and anonymous industrial kitbash.",
      "Any salvage detail that weakens function recognition, collision honesty or mobile state readability."
    ]
  },
  "quantitativeGrammar": {
    "standardizedChassisShare": {
      "min": 0.75,
      "max": 0.85
    },
    "authoredAdaptationShare": {
      "min": 0.15,
      "max": 0.25
    },
    "detailHierarchy": {
      "primary": 0.72,
      "secondary": 0.23,
      "tertiary": 0.05
    },
    "globalAsymmetry": {
      "target": 0.24,
      "max": 0.36
    },
    "assetAsymmetryTargets": {
      "barricade": 0.24,
      "objective_core": 0.22,
      "enemy_standard": 0.3,
      "floor_module": 0.16,
      "damage_effect": 0.34,
      "turret_fast_v1": 0.24
    },
    "primarySecondarySizeRatio": {
      "min": 2.5,
      "max": 4.8
    },
    "repairNarrativesMax": 2,
    "patchFamiliesMax": 2,
    "visibleMaterialFamiliesMax": 3,
    "semanticAccentCoverageMax": 0.12,
    "warningCoverageMax": 0.08,
    "criticalCoverageMax": 0.08,
    "minimumMobileReadDistanceStuds": 60
  },
  "palette": {
    "primary": "#343A3C",
    "secondary": "#B8AD96",
    "accent": "#C7763E",
    "interaction": "#5FE0C1",
    "threat": "#9D455B",
    "warning": "#E5B94A",
    "critical": "#E4524E",
    "rubber": "#202322",
    "bareMetal": "#7F8783",
    "allocationRules": [
      "Quiet structural neutrals occupy most visible area so silhouette and state breaks remain dominant.",
      "Sun-baked copper marks player authorship, approved replacement and intervention rather than generic decoration.",
      "Mint interaction light is protected, local and never used as broad surface paint.",
      "Threat raspberry belongs to hostile forward-facing anatomy and never contaminates player-owned structure.",
      "Warning gold and critical red remain below their coverage caps and require non-color shape cues."
    ]
  },
  "materials": {
    "priority": [
      "painted_metal",
      "reclaimed_composite",
      "bare_metal",
      "rubber",
      "reclaimed_wood_contextual_only"
    ],
    "surfaceLogic": [
      "Player technology uses broad coated structural planes over a dependable standardized chassis.",
      "Replacement modules differ through value, joint language and edge history, not arbitrary material roulette.",
      "Bare metal appears at load paths, hinges, exposed breaks and repair interfaces rather than as global shine.",
      "Rubber and soft protection remain confined to feet, grips, seals, bumpers and vibration contacts.",
      "Wood is reserved for believable low-energy architecture, temporary field structures or biome-specific recovery, never every machine."
    ],
    "wearLogic": [
      "Every scar must answer what caused it, when it happened and why it remains visible.",
      "Intact means maintained, not factory-new: one or two old repaired histories may remain without implying current failure.",
      "Damaged states expose one causal weakness; critical states widen the same failure chain.",
      "Wear density decreases with camera distance and may not compete with interaction, threat or state cues.",
      "Repair surfaces are cleaner at the new joint and older away from it, producing readable temporal layering."
    ],
    "forbidden": [
      "Uniform rust, full-surface grunge, noisy normal maps and identical scratches on every asset.",
      "More than three visible material families on a normal gameplay prop.",
      "Wooden armor on high-energy machinery without a thermal or structural justification.",
      "Specular-only material identity that disappears under adverse lighting.",
      "Material changes that imitate interaction, danger or team ownership without semantic intent."
    ]
  },
  "scopes": {
    "worldNarrative": {
      "purpose": "Make the entire world express intelligent survival, persistence and human authorship.",
      "deepReason": "The GDD makes the fortress a home, workshop, strategy space, social space and museum. A world that visibly remembers repair and adaptation turns progression into identity instead of inventory accumulation.",
      "rules": [
        "Civilization appears pressured but capable, organized and future-facing.",
        "Standardized infrastructure proves shared knowledge; local adaptations prove personal history.",
        "Every location contains one legible story of need, response and improved survival.",
        "Hope is expressed through maintenance, warm intervention and active reuse rather than pristine abundance."
      ],
      "failureModes": [
        "Bleak post-apocalyptic misery with no evidence of competence or future.",
        "Random salvage decoration that cannot explain a need or a repair decision.",
        "Generic sci-fi frontier visuals disconnected from fortress experimentation."
      ],
      "acceptance": [
        "A viewer can describe what the inhabitants protected, repaired or repurposed.",
        "The scene feels inhabited by capable builders rather than abandoned.",
        "The fortress remains the dominant authored protagonist."
      ]
    },
    "silhouetteAndMassing": {
      "purpose": "Guarantee instant function and distinctive identity at mobile distance.",
      "deepReason": "Players must act before they can inspect texture. Thick primary masses lower recognition time, while one controlled adaptation landmark gives the object memorable authorship without weakening its gameplay icon.",
      "rules": [
        "Primary silhouette carries function, orientation and footprint before any salvage treatment.",
        "Each object owns one dominant silhouette sentence and at most two supporting landmarks.",
        "Negative spaces are few, large and functional.",
        "The authored adaptation modifies a secondary mass or edge rhythm, not the core collision promise."
      ],
      "failureModes": [
        "Many equal-sized parts producing a scrap cloud.",
        "Thin antennas, rails or cables becoming essential recognition landmarks.",
        "Asymmetry that changes perceived hitbox, forward direction or ground stability."
      ],
      "acceptance": [
        "Black silhouette identifies function and front at the target distance.",
        "Removing tertiary details does not change recognition.",
        "The object remains recognizable in groups of thirty."
      ]
    },
    "constructionAndModularity": {
      "purpose": "Make every assembly plausible, repairable and reusable as a production system.",